Sheet: Sheet2
A1: 0.93 | B1: =RC[-1]+RAND()*0.2-0.1 -> 0.87226702545596524
A2: 0.91 | B2: =RC[-1]+RAND()*0.2-0.1 -> 1.0029916016893217
A3: 0.56000000000000005 | B3: =RC[-1]+RAND()*0.2-0.1 -> 0.47351916100193214
A4: 0.71 | B4: =RC[-1]+RAND()*0.2-0.1 -> 0.74626427642651716
A5: 0.67 | B5: =RC[-1]+RAND()*0.2-0.1 -> 0.70721120750238298
A6: 0.66 | B6: =RC[-1]+RAND()*0.2-0.1 -> 0.5738010841012906
A7: 0.61 | B7: =RC[-1]+RAND()*0.2-0.1 -> 0.53826197403876164
A8: 0.84 | B8: =RC[-1]+RAND()*0.2-0.1 -> 0.88975685227433066
A9: 0.74 | B9: =RC[-1]+RAND()*0.2-0.1 -> 0.71280475700565271
A10: 0.69 | B10: =RC[-1]+RAND()*0.2-0.1 -> 0.67959078246485638
A11: 0.72 | B11: =RC[-1]+RAND()*0.2-0.1 -> 0.68268721161262702
A12: 0.56000000000000005 | B12: =RC[-1]+RAND()*0.2-0.1 -> 0.46238713699606404
A13: 0.55000000000000004 | B13: =RC[-1]+RAND()*0.2-0.1 -> 0.514322647611683
A14: 0.84 | B14: =RC[-1]+RAND()*0.2-0.1 -> 0.93468131359175588
A15: 0.71 | B15: =RC[-1]+RAND()*0.2-0.1 -> 0.75509676650408952
A16: 0.52 | B16: =RC[-1]+RAND()*0.2-0.1 -> 0.49845449822345311
A17: 0.52 | B17: =RC[-1]+RAND()*0.2-0.1 -> 0.55591887042155397
A18: 0.51 | B18: =RC[-1]+RAND()*0.2-0.1 -> 0.44861530113227988
A19: 0.63 | B19: =RC[-1]+RAND()*0.2-0.1 -> 0.58307042009604104
A20: 0.55000000000000004 | B20: =RC[-1]+RAND()*0.2-0.1 -> 0.45624224286711346
A21: 0.53 | B21: =RC[-1]+RAND()*0.2-0.1 -> 0.60758886337053875
A22: 0.66 | B22: =RC[-1]+RAND()*0.2-0.1 -> 0.70510964250180874
A23: 0.96 | B23: =RC[-1]+RAND()*0.2-0.1 -> 1.0366329084231936
A24: 0.87 | B24: =RC[-1]+RAND()*0.2-0.1 -> 0.78196383948102199
A25: 0.84 | B25: =RC[-1]+RAND()*0.2-0.1 -> 0.79321532445337239
A26: 0.54 | B26: =RC[-1]+RAND()*0.2-0.1 -> 0.61149200432858131
A27: 0.68 | B27: =RC[-1]+RAND()*0.2-0.1 -> 0.63365840944710006
A28: 0.63 | B28: =RC[-1]+RAND()*0.2-0.1 -> 0.63619355078900153
A29: 0.72 | B29: =RC[-1]+RAND()*0.2-0.1 -> 0.75090810397958407
A30: 0.67 | B30: =RC[-1]+RAND()*0.2-0.1 -> 0.5723841547136399
A31: 0.79 | B31: =RC[-1]+RAND()*0.2-0.1 -> 0.72597384590633318
A32: 0.54 | B32: =RC[-1]+RAND()*0.2-0.1 -> 0.56138391936288567
A33: 0.61 | B33: =RC[-1]+RAND()*0.2-0.1 -> 0.64605483772096484
A34: 0.52 | B34: =RC[-1]+RAND()*0.2-0.1 -> 0.50379746412065518
A35: 0.62 | B35: =RC[-1]+RAND()*0.2-0.1 -> 0.5703540980273023
A36: 0.62 | B36: =RC[-1]+RAND()*0.2-0.1 -> 0.64333262696023952
A37: 0.97 | B37: =RC[-1]+RAND()*0.2-0.1 -> 0.99469254406006702
A38: 0.77 | B38: =RC[-1]+RAND()*0.2-0.1 -> 0.75410786991984413
A39: 0.55000000000000004 | B39: =RC[-1]+RAND()*0.2-0.1 -> 0.64045721175662462
A40: 0.64 | B40: =RC[-1]+RAND()*0.2-0.1 -> 0.61013129808952637
A41: 0.67 | B41: =RC[-1]+RAND()*0.2-0.1 -> 0.60314565966555556
A42: 0.77 | B42: =RC[-1]+RAND()*0.2-0.1 -> 0.70916334672086057
A43: 0.74 | B43: =RC[-1]+RAND()*0.2-0.1 -> 0.83080560446145768
A44: 0.87 | B44: =RC[-1]+RAND()*0.2-0.1 -> 0.95850393961239189
A45: 0.84 | B45: =RC[-1]+RAND()*0.2-0.1 -> 0.84387725836327443
A46: 0.81 | B46: =RC[-1]+RAND()*0.2-0.1 -> 0.7644598794369063
A47: 0.96 | B47: =RC[-1]+RAND()*0.2-0.1 -> 1.0490045749369115
A48: 0.63 | B48: =RC[-1]+RAND()*0.2-0.1 -> 0.6274255547730645
A49: 0.51 | B49: =RC[-1]+RAND()*0.2-0.1 -> 0.59016883087591021
A50: 0.92 | B50: =RC[-1]+RAND()*0.2-0.1 -> 0.84722866884862336
A51: 0.63 | B51: =RC[-1]+RAND()*0.2-0.1 -> 0.55051195230969385
A52: 0.89 | B52: =RC[-1]+RAND()*0.2-0.1 -> 0.85004125501195793
A53: 0.7 | B53: =RC[-1]+RAND()*0.2-0.1 -> 0.65731077732261645
A54: 0.56999999999999995 | B54: =RC[-1]+RAND()*0.2-0.1 -> 0.62000025643010614
A55: 0.75 | B55: =RC[-1]+RAND()*0.2-0.1 -> 0.66747137053421246
A56: 0.81 | B56: =RC[-1]+RAND()*0.2-0.1 -> 0.81023025584013675
A57: 0.85 | B57: =RC[-1]+RAND()*0.2-0.1 -> 0.7608064282702649
A58: 0.56999999999999995 | B58: =RC[-1]+RAND()*0.2-0.1 -> 0.56175166410926913
A59: 0.66 | B59: =RC[-1]+RAND()*0.2-0.1 -> 0.63882191415137368
A60: 0.56000000000000005 | B60: =RC[-1]+RAND()*0.2-0.1 -> 0.53052463267408156
A61: 0.74 | B61: =RC[-1]+RAND()*0.2-0.1 -> 0.65937929522466121
A62: 0.69 | B62: =RC[-1]+RAND()*0.2-0.1 -> 0.74520589095836354
A63: 0.68 | B63: =RC[-1]+RAND()*0.2-0.1 -> 0.62046072183238099
A64: 0.52 | B64: =RC[-1]+RAND()*0.2-0.1 -> 0.47915772635780385
A65: 0.69 | B65: =RC[-1]+RAND()*0.2-0.1 -> 0.60446083079727619
A66: 0.6 | B66: =RC[-1]+RAND()*0.2-0.1 -> 0.57113988618665612
A67: 0.76 | B67: =RC[-1]+RAND()*0.2-0.1 -> 0.82174426358566077
A68: 0.63 | B68: =RC[-1]+RAND()*0.2-0.1 -> 0.65194330481928819
A69: 0.72 | B69: =RC[-1]+RAND()*0.2-0.1 -> 0.62233106922802317
A70: 0.51 | B70: =RC[-1]+RAND()*0.2-0.1 -> 0.53889165001783212
A71: 0.94 | B71: =RC[-1]+RAND()*0.2-0.1 -> 0.92846964353068062
A72: 0.85 | B72: =RC[-1]+RAND()*0.2-0.1 -> 0.85747645097641334
A73: 0.88 | B73: =RC[-1]+RAND()*0.2-0.1 -> 0.83969461447832017
A74: 0.76 | B74: =RC[-1]+RAND()*0.2-0.1 -> 0.70823216936530864
A75: 0.54 | B75: =RC[-1]+RAND()*0.2-0.1 -> 0.55237933730565336
A76: 0.6 | B76: =RC[-1]+RAND()*0.2-0.1 -> 0.53061437577035098
A77: 0.97 | B77: =RC[-1]+RAND()*0.2-0.1 -> 0.95986908651579983
A78: 0.91 | B78: =RC[-1]+RAND()*0.2-0.1 -> 0.90679683006415235
A79: 0.7 | B79: =RC[-1]+RAND()*0.2-0.1 -> 0.60502595962046934
A80: 0.52 | B80: =RC[-1]+RAND()*0.2-0.1 -> 0.48610129969052618
A81: 0.92 | B81: =RC[-1]+RAND()*0.2-0.1 -> 1.0111120407739034
A82: 0.89 | B82: =RC[-1]+RAND()*0.2-0.1 -> 0.81983089618187466
A83: 0.69 | B83: =RC[-1]+RAND()*0.2-0.1 -> 0.7540635784586488
A84: 0.9 | B84: =RC[-1]+RAND()*0.2-0.1 -> 0.84042446689963168
A85: 0.76 | B85: =RC[-1]+RAND()*0.2-0.1 -> 0.83730189516499232
A86: 0.55000000000000004 | B86: =RC[-1]+RAND()*0.2-0.1 -> 0.4746092041997283
A87: 0.78 | B87: =RC[-1]+RAND()*0.2-0.1 -> 0.84448897266904333
A88: 0.66 | B88: =RC[-1]+RAND()*0.2-0.1 -> 0.65951247828573134
A89: 0.68 | B89: =RC[-1]+RAND()*0.2-0.1 -> 0.58223785345060486
A90: 0.71 | B90: =RC[-1]+RAND()*0.2-0.1 -> 0.69971464155252894
A91: 0.66 | B91: =RC[-1]+RAND()*0.2-0.1 -> 0.7172976967445085
A92: 0.59 | B92: =RC[-1]+RAND()*0.2-0.1 -> 0.61507096813553974
A93: 0.75 | B93: =RC[-1]+RAND()*0.2-0.1 -> 0.74297661794678482
A94: 0.69 | B94: =RC[-1]+RAND()*0.2-0.1 -> 0.67725886727974816
A95: 0.91 | B95: =RC[-1]+RAND()*0.2-0.1 -> 0.97860648372919956
A96: 0.63 | B96: =RC[-1]+RAND()*0.2-0.1 -> 0.580956321784454
A97: 0.95 | B97: =RC[-1]+RAND()*0.2-0.1 -> 0.97704548064050323
A98: 0.7 | B98: =RC[-1]+RAND()*0.2-0.1 -> 0.63490778016418725
A99: 0.55000000000000004 | B99: =RC[-1]+RAND()*0.2-0.1 -> 0.48364559177550681
A100: 0.74 | B100: =RC[-1]+RAND()*0.2-0.1 -> 0.82240973892911307