Sheet: Sheet2
A1: 0.99 | B1: 0.99 | C1: =ABS(RC[-2]-RC[-1]) -> 0
A2: 0.99 | B2: 0.99 | C2: =ABS(RC[-2]-RC[-1]) -> 0
A3: 0.99 | B3: 0.99 | C3: =ABS(RC[-2]-RC[-1]) -> 0
A4: 0.99 | B4: 0.99 | C4: =ABS(RC[-2]-RC[-1]) -> 0
A5: 0.99 | B5: 0.99 | C5: =ABS(RC[-2]-RC[-1]) -> 0
A6: 0.99 | B6: 0.99 | C6: =ABS(RC[-2]-RC[-1]) -> 0
A7: 0.99 | B7: 0.99 | C7: =ABS(RC[-2]-RC[-1]) -> 0
A8: 0.99 | B8: 0.99 | C8: =ABS(RC[-2]-RC[-1]) -> 0
A9: 0.99 | B9: 0.99 | C9: =ABS(RC[-2]-RC[-1]) -> 0
A10: 0.99 | B10: 0.99 | C10: =ABS(RC[-2]-RC[-1]) -> 0
A11: 0.99 | B11: 0.99 | C11: =ABS(RC[-2]-RC[-1]) -> 0
A12: 0.99 | B12: 0.99 | C12: =ABS(RC[-2]-RC[-1]) -> 0
A13: 0.99 | B13: 0.99 | C13: =ABS(RC[-2]-RC[-1]) -> 0
A14: 0.99 | B14: 0.99 | C14: =ABS(RC[-2]-RC[-1]) -> 0
A15: 0.99 | B15: 0.99 | C15: =ABS(RC[-2]-RC[-1]) -> 0
A16: 0.99 | B16: 0.99 | C16: =ABS(RC[-2]-RC[-1]) -> 0
A17: 0.99 | B17: 0.98 | C17: =ABS(RC[-2]-RC[-1]) -> 1.0000000000000009E-2
A18: 0.99 | B18: 0.98 | C18: =ABS(RC[-2]-RC[-1]) -> 1.0000000000000009E-2
A19: 0.99 | B19: 0.98 | C19: =ABS(RC[-2]-RC[-1]) -> 1.0000000000000009E-2
A20: 0.99 | B20: 0.98 | C20: =ABS(RC[-2]-RC[-1]) -> 1.0000000000000009E-2
A21: 0.98 | B21: 0.97 | C21: =ABS(RC[-2]-RC[-1]) -> 1.0000000000000009E-2
A22: 0.98 | B22: 0.97 | C22: =ABS(RC[-2]-RC[-1]) -> 1.0000000000000009E-2
A23: 0.98 | B23: 0.97 | C23: =ABS(RC[-2]-RC[-1]) -> 1.0000000000000009E-2
A24: 0.98 | B24: 0.97 | C24: =ABS(RC[-2]-RC[-1]) -> 1.0000000000000009E-2
A25: 0.98 | B25: 0.96 | C25: =ABS(RC[-2]-RC[-1]) -> 2.0000000000000018E-2
A26: 0.98 | B26: 0.96 | C26: =ABS(RC[-2]-RC[-1]) -> 2.0000000000000018E-2
A27: 0.98 | B27: 0.96 | C27: =ABS(RC[-2]-RC[-1]) -> 2.0000000000000018E-2
A28: 0.98 | B28: 0.96 | C28: =ABS(RC[-2]-RC[-1]) -> 2.0000000000000018E-2
A29: 0.98 | B29: 0.96 | C29: =ABS(RC[-2]-RC[-1]) -> 2.0000000000000018E-2
A30: 0.98 | B30: 0.96 | C30: =ABS(RC[-2]-RC[-1]) -> 2.0000000000000018E-2
A31: 0.98 | B31: 0.96 | C31: =ABS(RC[-2]-RC[-1]) -> 2.0000000000000018E-2
A32: 0.98 | B32: 0.96 | C32: =ABS(RC[-2]-RC[-1]) -> 2.0000000000000018E-2
A33: 0.98 | B33: 0.95 | C33: =ABS(RC[-2]-RC[-1]) -> 3.0000000000000027E-2
A34: 0.98 | B34: 0.95 | C34: =ABS(RC[-2]-RC[-1]) -> 3.0000000000000027E-2
A35: 0.98 | B35: 0.95 | C35: =ABS(RC[-2]-RC[-1]) -> 3.0000000000000027E-2
A36: 0.98 | B36: 0.95 | C36: =ABS(RC[-2]-RC[-1]) -> 3.0000000000000027E-2
A37: 0.98 | B37: 0.95 | C37: =ABS(RC[-2]-RC[-1]) -> 3.0000000000000027E-2
A38: 0.98 | B38: 0.95 | C38: =ABS(RC[-2]-RC[-1]) -> 3.0000000000000027E-2
A39: 0.98 | B39: 0.94 | C39: =ABS(RC[-2]-RC[-1]) -> 4.0000000000000036E-2
A40: 0.98 | B40: 0.94 | C40: =ABS(RC[-2]-RC[-1]) -> 4.0000000000000036E-2
A41: 0.98 | B41: 0.94 | C41: =ABS(RC[-2]-RC[-1]) -> 4.0000000000000036E-2
A42: 0.98 | B42: 0.94 | C42: =ABS(RC[-2]-RC[-1]) -> 4.0000000000000036E-2
A43: 0.98 | B43: 0.93 | C43: =ABS(RC[-2]-RC[-1]) -> 4.9999999999999933E-2
A44: 0.98 | B44: 0.93 | C44: =ABS(RC[-2]-RC[-1]) -> 4.9999999999999933E-2
A45: 0.98 | B45: 0.93 | C45: =ABS(RC[-2]-RC[-1]) -> 4.9999999999999933E-2
A46: 0.98 | B46: 0.93 | C46: =ABS(RC[-2]-RC[-1]) -> 4.9999999999999933E-2
A47: 0.98 | B47: 0.93 | C47: =ABS(RC[-2]-RC[-1]) -> 4.9999999999999933E-2
A48: 0.98 | B48: 0.93 | C48: =ABS(RC[-2]-RC[-1]) -> 4.9999999999999933E-2
A49: 0.98 | B49: 0.93 | C49: =ABS(RC[-2]-RC[-1]) -> 4.9999999999999933E-2
A50: 0.98 | B50: 0.93 | C50: =ABS(RC[-2]-RC[-1]) -> 4.9999999999999933E-2
A51: 0.97 | B51: 0.93 | C51: =ABS(RC[-2]-RC[-1]) -> 3.9999999999999925E-2
A52: 0.97 | B52: 0.93 | C52: =ABS(RC[-2]-RC[-1]) -> 3.9999999999999925E-2
A53: 0.97 | B53: 0.92 | C53: =ABS(RC[-2]-RC[-1]) -> 4.9999999999999933E-2
A54: 0.97 | B54: 0.92 | C54: =ABS(RC[-2]-RC[-1]) -> 4.9999999999999933E-2
A55: 0.97 | B55: 0.92 | C55: =ABS(RC[-2]-RC[-1]) -> 4.9999999999999933E-2
A56: 0.97 | B56: 0.92 | C56: =ABS(RC[-2]-RC[-1]) -> 4.9999999999999933E-2
A57: 0.97 | B57: 0.92 | C57: =ABS(RC[-2]-RC[-1]) -> 4.9999999999999933E-2
A58: 0.97 | B58: 0.92 | C58: =ABS(RC[-2]-RC[-1]) -> 4.9999999999999933E-2
A59: 0.97 | B59: 0.92 | C59: =ABS(RC[-2]-RC[-1]) -> 4.9999999999999933E-2
A60: 0.97 | B60: 0.92 | C60: =ABS(RC[-2]-RC[-1]) -> 4.9999999999999933E-2
A61: 0.97 | B61: 0.92 | C61: =ABS(RC[-2]-RC[-1]) -> 4.9999999999999933E-2
A62: 0.97 | B62: 0.92 | C62: =ABS(RC[-2]-RC[-1]) -> 4.9999999999999933E-2
A63: 0.97 | B63: 0.91 | C63: =ABS(RC[-2]-RC[-1]) -> 5.9999999999999942E-2
A64: 0.97 | B64: 0.91 | C64: =ABS(RC[-2]-RC[-1]) -> 5.9999999999999942E-2
A65: 0.96 | B65: 0.91 | C65: =ABS(RC[-2]-RC[-1]) -> 4.9999999999999933E-2
A66: 0.96 | B66: 0.91 | C66: =ABS(RC[-2]-RC[-1]) -> 4.9999999999999933E-2
A67: 0.96 | B67: 0.91 | C67: =ABS(RC[-2]-RC[-1]) -> 4.9999999999999933E-2
A68: 0.96 | B68: 0.91 | C68: =ABS(RC[-2]-RC[-1]) -> 4.9999999999999933E-2
A69: 0.96 | B69: 0.91 | C69: =ABS(RC[-2]-RC[-1]) -> 4.9999999999999933E-2
A70: 0.96 | B70: 0.91 | C70: =ABS(RC[-2]-RC[-1]) -> 4.9999999999999933E-2
A71: 0.96 | B71: 0.89 | C71: =ABS(RC[-2]-RC[-1]) -> 6.9999999999999951E-2
A72: 0.96 | B72: 0.89 | C72: =ABS(RC[-2]-RC[-1]) -> 6.9999999999999951E-2
A73: 0.96 | B73: 0.89 | C73: =ABS(RC[-2]-RC[-1]) -> 6.9999999999999951E-2
A74: 0.96 | B74: 0.89 | C74: =ABS(RC[-2]-RC[-1]) -> 6.9999999999999951E-2
A75: 0.96 | B75: 0.89 | C75: =ABS(RC[-2]-RC[-1]) -> 6.9999999999999951E-2
A76: 0.96 | B76: 0.89 | C76: =ABS(RC[-2]-RC[-1]) -> 6.9999999999999951E-2
A77: 0.96 | B77: 0.89 | C77: =ABS(RC[-2]-RC[-1]) -> 6.9999999999999951E-2
A78: 0.96 | B78: 0.89 | C78: =ABS(RC[-2]-RC[-1]) -> 6.9999999999999951E-2
A79: 0.96 | B79: 0.87 | C79: =ABS(RC[-2]-RC[-1]) -> 8.9999999999999969E-2
A80: 0.96 | B80: 0.87 | C80: =ABS(RC[-2]-RC[-1]) -> 8.9999999999999969E-2
A81: 0.96 | B81: 0.78 | C81: =ABS(RC[-2]-RC[-1]) -> 0.17999999999999994
A82: 0.96 | B82: 0.78 | C82: =ABS(RC[-2]-RC[-1]) -> 0.17999999999999994
A83: 0.9 | B83: 0.71 | C83: =ABS(RC[-2]-RC[-1]) -> 0.19000000000000006
A84: 0.9 | B84: 0.71 | C84: =ABS(RC[-2]-RC[-1]) -> 0.19000000000000006
A85: 0.9 | B85: 0.69 | C85: =ABS(RC[-2]-RC[-1]) -> 0.21000000000000008
A86: 0.9 | B86: 0.69 | C86: =ABS(RC[-2]-RC[-1]) -> 0.21000000000000008
A87: 0.89 | B87: 0.66 | C87: =ABS(RC[-2]-RC[-1]) -> 0.22999999999999998
A88: 0.89 | B88: 0.66 | C88: =ABS(RC[-2]-RC[-1]) -> 0.22999999999999998
A89: 0.7 | B89: 0.64 | C89: =ABS(RC[-2]-RC[-1]) -> 5.9999999999999942E-2
A90: 0.7 | B90: 0.64 | C90: =ABS(RC[-2]-RC[-1]) -> 5.9999999999999942E-2
A91: 0.7 | B91: 0.63 | C91: =ABS(RC[-2]-RC[-1]) -> 6.9999999999999951E-2
A92: 0.7 | B92: 0.63 | C92: =ABS(RC[-2]-RC[-1]) -> 6.9999999999999951E-2
A93: 0.69 | B93: 0.61 | C93: =ABS(RC[-2]-RC[-1]) -> 7.999999999999996E-2
A94: 0.69 | B94: 0.61 | C94: =ABS(RC[-2]-RC[-1]) -> 7.999999999999996E-2
A95: 0.69 | B95: 0.42 | C95: =ABS(RC[-2]-RC[-1]) -> 0.26999999999999996
A96: 0.69 | B96: 0.42 | C96: =ABS(RC[-2]-RC[-1]) -> 0.26999999999999996
A97: 0.69 | B97: 0.35 | C97: =ABS(RC[-2]-RC[-1]) -> 0.33999999999999997
A98: 0.69 | B98: 0.35 | C98: =ABS(RC[-2]-RC[-1]) -> 0.33999999999999997
A99: 0.69 | B99: 0.34 | C99: =ABS(RC[-2]-RC[-1]) -> 0.34999999999999992
A100: 0.69 | B100: 0.34 | C100: =ABS(RC[-2]-RC[-1]) -> 0.34999999999999992