Sheet: Sheet2
A1: 0.99 | B1: 0.99 | C1: =ABS(RC[-2]-RC[-1]) -> 0
A2: 0.99 | B2: 0.99 | C2: =ABS(RC[-2]-RC[-1]) -> 0
A3: 0.99 | B3: 0.99 | C3: =ABS(RC[-2]-RC[-1]) -> 0
A4: 0.98 | B4: 0.98 | C4: =ABS(RC[-2]-RC[-1]) -> 0
A5: 0.96 | B5: 0.96 | C5: =ABS(RC[-2]-RC[-1]) -> 0
A6: 0.95 | B6: 0.95 | C6: =ABS(RC[-2]-RC[-1]) -> 0
A7: 0.94 | B7: 0.94 | C7: =ABS(RC[-2]-RC[-1]) -> 0
A8: 0.93 | B8: 0.93 | C8: =ABS(RC[-2]-RC[-1]) -> 0
A9: 0.93 | B9: 0.93 | C9: =ABS(RC[-2]-RC[-1]) -> 0
A10: 0.93 | B10: 0.93 | C10: =ABS(RC[-2]-RC[-1]) -> 0
A11: 0.92 | B11: 0.92 | C11: =ABS(RC[-2]-RC[-1]) -> 0
A12: 0.92 | B12: 0.92 | C12: =ABS(RC[-2]-RC[-1]) -> 0
A13: 0.92 | B13: 0.92 | C13: =ABS(RC[-2]-RC[-1]) -> 0
A14: 0.91 | B14: 0.91 | C14: =ABS(RC[-2]-RC[-1]) -> 0
A15: 0.91 | B15: 0.91 | C15: =ABS(RC[-2]-RC[-1]) -> 0
A16: 0.91 | B16: 0.91 | C16: =ABS(RC[-2]-RC[-1]) -> 0
A17: 0.91 | B17: 0.91 | C17: =ABS(RC[-2]-RC[-1]) -> 0
A18: 0.91 | B18: 0.91 | C18: =ABS(RC[-2]-RC[-1]) -> 0
A19: 0.9 | B19: 0.9 | C19: =ABS(RC[-2]-RC[-1]) -> 0
A20: 0.9 | B20: 0.9 | C20: =ABS(RC[-2]-RC[-1]) -> 0
A21: 0.9 | B21: 0.9 | C21: =ABS(RC[-2]-RC[-1]) -> 0
A22: 0.9 | B22: 0.9 | C22: =ABS(RC[-2]-RC[-1]) -> 0
A23: 0.89 | B23: 0.89 | C23: =ABS(RC[-2]-RC[-1]) -> 0
A24: 0.89 | B24: 0.89 | C24: =ABS(RC[-2]-RC[-1]) -> 0
A25: 0.89 | B25: 0.89 | C25: =ABS(RC[-2]-RC[-1]) -> 0
A26: 0.89 | B26: 0.89 | C26: =ABS(RC[-2]-RC[-1]) -> 0
A27: 0.89 | B27: 0.89 | C27: =ABS(RC[-2]-RC[-1]) -> 0
A28: 0.88 | B28: 0.88 | C28: =ABS(RC[-2]-RC[-1]) -> 0
A29: 0.88 | B29: 0.88 | C29: =ABS(RC[-2]-RC[-1]) -> 0
A30: 0.88 | B30: 0.88 | C30: =ABS(RC[-2]-RC[-1]) -> 0
A31: 0.88 | B31: 0.88 | C31: =ABS(RC[-2]-RC[-1]) -> 0
A32: 0.88 | B32: 0.88 | C32: =ABS(RC[-2]-RC[-1]) -> 0
A33: 0.87 | B33: 0.87 | C33: =ABS(RC[-2]-RC[-1]) -> 0
A34: 0.87 | B34: 0.87 | C34: =ABS(RC[-2]-RC[-1]) -> 0
A35: 0.87 | B35: 0.87 | C35: =ABS(RC[-2]-RC[-1]) -> 0
A36: 0.87 | B36: 0.87 | C36: =ABS(RC[-2]-RC[-1]) -> 0
A37: 0.87 | B37: 0.87 | C37: =ABS(RC[-2]-RC[-1]) -> 0
A38: 0.87 | B38: 0.87 | C38: =ABS(RC[-2]-RC[-1]) -> 0
A39: 0.86 | B39: 0.86 | C39: =ABS(RC[-2]-RC[-1]) -> 0
A40: 0.86 | B40: 0.86 | C40: =ABS(RC[-2]-RC[-1]) -> 0
A41: 0.86 | B41: 0.86 | C41: =ABS(RC[-2]-RC[-1]) -> 0
A42: 0.86 | B42: 0.86 | C42: =ABS(RC[-2]-RC[-1]) -> 0
A43: 0.86 | B43: 0.86 | C43: =ABS(RC[-2]-RC[-1]) -> 0
A44: 0.86 | B44: 0.86 | C44: =ABS(RC[-2]-RC[-1]) -> 0
A45: 0.85 | B45: 0.85 | C45: =ABS(RC[-2]-RC[-1]) -> 0
A46: 0.85 | B46: 0.85 | C46: =ABS(RC[-2]-RC[-1]) -> 0
A47: 0.85 | B47: 0.85 | C47: =ABS(RC[-2]-RC[-1]) -> 0
A48: 0.85 | B48: 0.85 | C48: =ABS(RC[-2]-RC[-1]) -> 0
A49: 0.85 | B49: 0.85 | C49: =ABS(RC[-2]-RC[-1]) -> 0
A50: 0.85 | B50: 0.85 | C50: =ABS(RC[-2]-RC[-1]) -> 0
A51: 0.85 | B51: 0.85 | C51: =ABS(RC[-2]-RC[-1]) -> 0
A52: 0.94 | B52: 0.93 | C52: =ABS(RC[-2]-RC[-1]) -> 9.9999999999998979E-3
A53: 0.99 | B53: 0.98 | C53: =ABS(RC[-2]-RC[-1]) -> 1.0000000000000009E-2
A54: 0.98 | B54: 0.99 | C54: =ABS(RC[-2]-RC[-1]) -> 1.0000000000000009E-2
A55: 0.98 | B55: 0.99 | C55: =ABS(RC[-2]-RC[-1]) -> 1.0000000000000009E-2
A56: 0.98 | B56: 0.99 | C56: =ABS(RC[-2]-RC[-1]) -> 1.0000000000000009E-2
A57: 0.96 | B57: 0.97 | C57: =ABS(RC[-2]-RC[-1]) -> 1.0000000000000009E-2
A58: 0.96 | B58: 0.95 | C58: =ABS(RC[-2]-RC[-1]) -> 1.0000000000000009E-2
A59: 0.96 | B59: 0.95 | C59: =ABS(RC[-2]-RC[-1]) -> 1.0000000000000009E-2
A60: 0.95 | B60: 0.94 | C60: =ABS(RC[-2]-RC[-1]) -> 1.0000000000000009E-2
A61: 0.92 | B61: 0.93 | C61: =ABS(RC[-2]-RC[-1]) -> 1.0000000000000009E-2
A62: 0.92 | B62: 0.93 | C62: =ABS(RC[-2]-RC[-1]) -> 1.0000000000000009E-2
A63: 0.92 | B63: 0.91 | C63: =ABS(RC[-2]-RC[-1]) -> 1.0000000000000009E-2
A64: 0.92 | B64: 0.91 | C64: =ABS(RC[-2]-RC[-1]) -> 1.0000000000000009E-2
A65: 0.91 | B65: 0.92 | C65: =ABS(RC[-2]-RC[-1]) -> 1.0000000000000009E-2
A66: 0.91 | B66: 0.9 | C66: =ABS(RC[-2]-RC[-1]) -> 1.0000000000000009E-2
A67: 0.9 | B67: 0.91 | C67: =ABS(RC[-2]-RC[-1]) -> 1.0000000000000009E-2
A68: 0.9 | B68: 0.91 | C68: =ABS(RC[-2]-RC[-1]) -> 1.0000000000000009E-2
A69: 0.9 | B69: 0.91 | C69: =ABS(RC[-2]-RC[-1]) -> 1.0000000000000009E-2
A70: 0.9 | B70: 0.91 | C70: =ABS(RC[-2]-RC[-1]) -> 1.0000000000000009E-2
A71: 0.9 | B71: 0.89 | C71: =ABS(RC[-2]-RC[-1]) -> 1.0000000000000009E-2
A72: 0.9 | B72: 0.89 | C72: =ABS(RC[-2]-RC[-1]) -> 1.0000000000000009E-2
A73: 0.89 | B73: 0.88 | C73: =ABS(RC[-2]-RC[-1]) -> 1.0000000000000009E-2
A74: 0.89 | B74: 0.88 | C74: =ABS(RC[-2]-RC[-1]) -> 1.0000000000000009E-2
A75: 0.89 | B75: 0.88 | C75: =ABS(RC[-2]-RC[-1]) -> 1.0000000000000009E-2
A76: 0.88 | B76: 0.87 | C76: =ABS(RC[-2]-RC[-1]) -> 1.0000000000000009E-2
A77: 0.87 | B77: 0.88 | C77: =ABS(RC[-2]-RC[-1]) -> 1.0000000000000009E-2
A78: 0.87 | B78: 0.88 | C78: =ABS(RC[-2]-RC[-1]) -> 1.0000000000000009E-2
A79: 0.87 | B79: 0.88 | C79: =ABS(RC[-2]-RC[-1]) -> 1.0000000000000009E-2
A80: 0.87 | B80: 0.86 | C80: =ABS(RC[-2]-RC[-1]) -> 1.0000000000000009E-2
A81: 0.87 | B81: 0.86 | C81: =ABS(RC[-2]-RC[-1]) -> 1.0000000000000009E-2
A82: 0.85 | B82: 0.86 | C82: =ABS(RC[-2]-RC[-1]) -> 1.0000000000000009E-2
A83: 0.85 | B83: 0.86 | C83: =ABS(RC[-2]-RC[-1]) -> 1.0000000000000009E-2
A84: 0.7 | B84: 0.71 | C84: =ABS(RC[-2]-RC[-1]) -> 1.0000000000000009E-2
A85: 0.7 | B85: 0.69 | C85: =ABS(RC[-2]-RC[-1]) -> 1.0000000000000009E-2
A86: 0.94 | B86: 0.92 | C86: =ABS(RC[-2]-RC[-1]) -> 1.9999999999999907E-2
A87: 0.99 | B87: 0.97 | C87: =ABS(RC[-2]-RC[-1]) -> 2.0000000000000018E-2
A88: 0.98 | B88: 0.96 | C88: =ABS(RC[-2]-RC[-1]) -> 2.0000000000000018E-2
A89: 0.98 | B89: 0.96 | C89: =ABS(RC[-2]-RC[-1]) -> 2.0000000000000018E-2
A90: 0.97 | B90: 0.99 | C90: =ABS(RC[-2]-RC[-1]) -> 2.0000000000000018E-2
A91: 0.97 | B91: 0.99 | C91: =ABS(RC[-2]-RC[-1]) -> 2.0000000000000018E-2
A92: 0.97 | B92: 0.99 | C92: =ABS(RC[-2]-RC[-1]) -> 2.0000000000000018E-2
A93: 0.97 | B93: 0.99 | C93: =ABS(RC[-2]-RC[-1]) -> 2.0000000000000018E-2
A94: 0.97 | B94: 0.99 | C94: =ABS(RC[-2]-RC[-1]) -> 2.0000000000000018E-2
A95: 0.96 | B95: 0.94 | C95: =ABS(RC[-2]-RC[-1]) -> 2.0000000000000018E-2
A96: 0.94 | B96: 0.96 | C96: =ABS(RC[-2]-RC[-1]) -> 2.0000000000000018E-2
A97: 0.93 | B97: 0.91 | C97: =ABS(RC[-2]-RC[-1]) -> 2.0000000000000018E-2
A98: 0.91 | B98: 0.93 | C98: =ABS(RC[-2]-RC[-1]) -> 2.0000000000000018E-2
A99: 0.91 | B99: 0.89 | C99: =ABS(RC[-2]-RC[-1]) -> 2.0000000000000018E-2
A100: 0.9 | B100: 0.92 | C100: =ABS(RC[-2]-RC[-1]) -> 2.0000000000000018E-2
A101: 0.89 | B101: 0.91 | C101: =ABS(RC[-2]-RC[-1]) -> 2.0000000000000018E-2
A102: 0.89 | B102: 0.91 | C102: =ABS(RC[-2]-RC[-1]) -> 2.0000000000000018E-2
A103: 0.89 | B103: 0.91 | C103: =ABS(RC[-2]-RC[-1]) -> 2.0000000000000018E-2
A104: 0.89 | B104: 0.87 | C104: =ABS(RC[-2]-RC[-1]) -> 2.0000000000000018E-2
A105: 0.88 | B105: 0.86 | C105: =ABS(RC[-2]-RC[-1]) -> 2.0000000000000018E-2
A106: 0.88 | B106: 0.86 | C106: =ABS(RC[-2]-RC[-1]) -> 2.0000000000000018E-2
A107: 0.87 | B107: 0.89 | C107: =ABS(RC[-2]-RC[-1]) -> 2.0000000000000018E-2
A108: 0.87 | B108: 0.89 | C108: =ABS(RC[-2]-RC[-1]) -> 2.0000000000000018E-2
A109: 0.87 | B109: 0.89 | C109: =ABS(RC[-2]-RC[-1]) -> 2.0000000000000018E-2
A110: 0.87 | B110: 0.85 | C110: =ABS(RC[-2]-RC[-1]) -> 2.0000000000000018E-2
A111: 0.87 | B111: 0.85 | C111: =ABS(RC[-2]-RC[-1]) -> 2.0000000000000018E-2
A112: 0.86 | B112: 0.84 | C112: =ABS(RC[-2]-RC[-1]) -> 2.0000000000000018E-2
A113: 0.86 | B113: 0.84 | C113: =ABS(RC[-2]-RC[-1]) -> 2.0000000000000018E-2
A114: 0.85 | B114: 0.87 | C114: =ABS(RC[-2]-RC[-1]) -> 2.0000000000000018E-2
A115: 0.85 | B115: 0.83 | C115: =ABS(RC[-2]-RC[-1]) -> 2.0000000000000018E-2
A116: 0.96 | B116: 0.93 | C116: =ABS(RC[-2]-RC[-1]) -> 2.9999999999999916E-2
A117: 0.96 | B117: 0.93 | C117: =ABS(RC[-2]-RC[-1]) -> 2.9999999999999916E-2
A118: 0.95 | B118: 0.92 | C118: =ABS(RC[-2]-RC[-1]) -> 2.9999999999999916E-2
A119: 0.95 | B119: 0.92 | C119: =ABS(RC[-2]-RC[-1]) -> 2.9999999999999916E-2
A120: 0.95 | B120: 0.92 | C120: =ABS(RC[-2]-RC[-1]) -> 2.9999999999999916E-2
A121: 0.94 | B121: 0.91 | C121: =ABS(RC[-2]-RC[-1]) -> 2.9999999999999916E-2
A122: 0.94 | B122: 0.91 | C122: =ABS(RC[-2]-RC[-1]) -> 2.9999999999999916E-2
A123: 0.94 | B123: 0.91 | C123: =ABS(RC[-2]-RC[-1]) -> 2.9999999999999916E-2
A124: 0.94 | B124: 0.91 | C124: =ABS(RC[-2]-RC[-1]) -> 2.9999999999999916E-2
A125: 0.93 | B125: 0.96 | C125: =ABS(RC[-2]-RC[-1]) -> 2.9999999999999916E-2
A126: 0.69 | B126: 0.66 | C126: =ABS(RC[-2]-RC[-1]) -> 2.9999999999999916E-2
A127: 0.99 | B127: 0.96 | C127: =ABS(RC[-2]-RC[-1]) -> 3.0000000000000027E-2
A128: 0.96 | B128: 0.99 | C128: =ABS(RC[-2]-RC[-1]) -> 3.0000000000000027E-2
A129: 0.88 | B129: 0.91 | C129: =ABS(RC[-2]-RC[-1]) -> 3.0000000000000027E-2
A130: 0.88 | B130: 0.85 | C130: =ABS(RC[-2]-RC[-1]) -> 3.0000000000000027E-2
A131: 0.86 | B131: 0.89 | C131: =ABS(RC[-2]-RC[-1]) -> 3.0000000000000027E-2
A132: 0.85 | B132: 0.82 | C132: =ABS(RC[-2]-RC[-1]) -> 3.0000000000000027E-2
A133: 0.97 | B133: 0.93 | C133: =ABS(RC[-2]-RC[-1]) -> 3.9999999999999925E-2
A134: 0.96 | B134: 0.92 | C134: =ABS(RC[-2]-RC[-1]) -> 3.9999999999999925E-2
A135: 0.95 | B135: 0.91 | C135: =ABS(RC[-2]-RC[-1]) -> 3.9999999999999925E-2
A136: 0.95 | B136: 0.91 | C136: =ABS(RC[-2]-RC[-1]) -> 3.9999999999999925E-2
A137: 0.9 | B137: 0.94 | C137: =ABS(RC[-2]-RC[-1]) -> 3.9999999999999925E-2
A138: 0.9 | B138: 0.94 | C138: =ABS(RC[-2]-RC[-1]) -> 3.9999999999999925E-2
A139: 0.9 | B139: 0.94 | C139: =ABS(RC[-2]-RC[-1]) -> 3.9999999999999925E-2
A140: 0.85 | B140: 0.81 | C140: =ABS(RC[-2]-RC[-1]) -> 3.9999999999999925E-2
A141: 0.69 | B141: 0.65 | C141: =ABS(RC[-2]-RC[-1]) -> 3.9999999999999925E-2
A142: 0.99 | B142: 0.95 | C142: =ABS(RC[-2]-RC[-1]) -> 4.0000000000000036E-2
A143: 0.89 | B143: 0.93 | C143: =ABS(RC[-2]-RC[-1]) -> 4.0000000000000036E-2
A144: 0.89 | B144: 0.85 | C144: =ABS(RC[-2]-RC[-1]) -> 4.0000000000000036E-2
A145: 0.88 | B145: 0.92 | C145: =ABS(RC[-2]-RC[-1]) -> 4.0000000000000036E-2
A146: 0.85 | B146: 0.89 | C146: =ABS(RC[-2]-RC[-1]) -> 4.0000000000000036E-2
A147: 0.85 | B147: 0.89 | C147: =ABS(RC[-2]-RC[-1]) -> 4.0000000000000036E-2
A148: 0.96 | B148: 0.91 | C148: =ABS(RC[-2]-RC[-1]) -> 4.9999999999999933E-2
A149: 0.94 | B149: 0.89 | C149: =ABS(RC[-2]-RC[-1]) -> 4.9999999999999933E-2
A150: 0.69 | B150: 0.64 | C150: =ABS(RC[-2]-RC[-1]) -> 4.9999999999999933E-2
A151: 0.99 | B151: 0.94 | C151: =ABS(RC[-2]-RC[-1]) -> 5.0000000000000044E-2
A152: 0.92 | B152: 0.87 | C152: =ABS(RC[-2]-RC[-1]) -> 5.0000000000000044E-2
A153: 0.89 | B153: 0.84 | C153: =ABS(RC[-2]-RC[-1]) -> 5.0000000000000044E-2
A154: 0.87 | B154: 0.82 | C154: =ABS(RC[-2]-RC[-1]) -> 5.0000000000000044E-2
A155: 0.99 | B155: 0.93 | C155: =ABS(RC[-2]-RC[-1]) -> 5.9999999999999942E-2
A156: 0.99 | B156: 0.93 | C156: =ABS(RC[-2]-RC[-1]) -> 5.9999999999999942E-2
A157: 0.98 | B157: 0.92 | C157: =ABS(RC[-2]-RC[-1]) -> 5.9999999999999942E-2
A158: 0.98 | B158: 0.92 | C158: =ABS(RC[-2]-RC[-1]) -> 5.9999999999999942E-2
A159: 0.91 | B159: 0.97 | C159: =ABS(RC[-2]-RC[-1]) -> 5.9999999999999942E-2
A160: 0.87 | B160: 0.81 | C160: =ABS(RC[-2]-RC[-1]) -> 5.9999999999999942E-2
A161: 0.87 | B161: 0.81 | C161: =ABS(RC[-2]-RC[-1]) -> 5.9999999999999942E-2
A162: 0.69 | B162: 0.63 | C162: =ABS(RC[-2]-RC[-1]) -> 5.9999999999999942E-2
A163: 0.92 | B163: 0.86 | C163: =ABS(RC[-2]-RC[-1]) -> 6.0000000000000053E-2
A164: 0.87 | B164: 0.93 | C164: =ABS(RC[-2]-RC[-1]) -> 6.0000000000000053E-2
A165: 0.99 | B165: 0.92 | C165: =ABS(RC[-2]-RC[-1]) -> 6.9999999999999951E-2
A166: 0.98 | B166: 0.91 | C166: =ABS(RC[-2]-RC[-1]) -> 6.9999999999999951E-2
A167: 0.96 | B167: 0.89 | C167: =ABS(RC[-2]-RC[-1]) -> 6.9999999999999951E-2
A168: 0.96 | B168: 0.89 | C168: =ABS(RC[-2]-RC[-1]) -> 6.9999999999999951E-2
A169: 0.94 | B169: 0.87 | C169: =ABS(RC[-2]-RC[-1]) -> 6.9999999999999951E-2
A170: 0.86 | B170: 0.79 | C170: =ABS(RC[-2]-RC[-1]) -> 6.9999999999999951E-2
A171: 0.84 | B171: 0.77 | C171: =ABS(RC[-2]-RC[-1]) -> 6.9999999999999951E-2
A172: 0.9 | B172: 0.83 | C172: =ABS(RC[-2]-RC[-1]) -> 7.0000000000000062E-2
A173: 0.86 | B173: 0.93 | C173: =ABS(RC[-2]-RC[-1]) -> 7.0000000000000062E-2
A174: 0.99 | B174: 0.91 | C174: =ABS(RC[-2]-RC[-1]) -> 7.999999999999996E-2
A175: 0.97 | B175: 0.89 | C175: =ABS(RC[-2]-RC[-1]) -> 7.999999999999996E-2
A176: 0.9 | B176: 0.98 | C176: =ABS(RC[-2]-RC[-1]) -> 7.999999999999996E-2
A177: 0.89 | B177: 0.81 | C177: =ABS(RC[-2]-RC[-1]) -> 7.999999999999996E-2
A178: 0.85 | B178: 0.93 | C178: =ABS(RC[-2]-RC[-1]) -> 8.0000000000000071E-2
A179: 0.98 | B179: 0.89 | C179: =ABS(RC[-2]-RC[-1]) -> 8.9999999999999969E-2
A180: 0.96 | B180: 0.87 | C180: =ABS(RC[-2]-RC[-1]) -> 8.9999999999999969E-2
A181: 0.92 | B181: 0.83 | C181: =ABS(RC[-2]-RC[-1]) -> 9.000000000000008E-2
A182: 0.96 | B182: 0.86 | C182: =ABS(RC[-2]-RC[-1]) -> 9.9999999999999978E-2
A183: 0.96 | B183: 0.86 | C183: =ABS(RC[-2]-RC[-1]) -> 9.9999999999999978E-2
A184: 0.89 | B184: 0.79 | C184: =ABS(RC[-2]-RC[-1]) -> 9.9999999999999978E-2
A185: 0.86 | B185: 0.76 | C185: =ABS(RC[-2]-RC[-1]) -> 9.9999999999999978E-2
A186: 0.98 | B186: 0.87 | C186: =ABS(RC[-2]-RC[-1]) -> 0.10999999999999999
A187: 0.92 | B187: 0.81 | C187: =ABS(RC[-2]-RC[-1]) -> 0.10999999999999999
A188: 0.98 | B188: 0.85 | C188: =ABS(RC[-2]-RC[-1]) -> 0.13
A189: 0.95 | B189: 0.81 | C189: =ABS(RC[-2]-RC[-1]) -> 0.1399999999999999
A190: 0.99 | B190: 0.85 | C190: =ABS(RC[-2]-RC[-1]) -> 0.14000000000000001
A191: 0.98 | B191: 0.84 | C191: =ABS(RC[-2]-RC[-1]) -> 0.14000000000000001
A192: 0.88 | B192: 0.74 | C192: =ABS(RC[-2]-RC[-1]) -> 0.14000000000000001
A193: 0.84 | B193: 0.99 | C193: =ABS(RC[-2]-RC[-1]) -> 0.15000000000000002
A194: 0.94 | B194: 0.78 | C194: =ABS(RC[-2]-RC[-1]) -> 0.15999999999999992
A195: 0.88 | B195: 0.72 | C195: =ABS(RC[-2]-RC[-1]) -> 0.16000000000000003
A196: 0.88 | B196: 0.71 | C196: =ABS(RC[-2]-RC[-1]) -> 0.17000000000000004
A197: 0.88 | B197: 0.71 | C197: =ABS(RC[-2]-RC[-1]) -> 0.17000000000000004
A198: 0.98 | B198: 0.78 | C198: =ABS(RC[-2]-RC[-1]) -> 0.19999999999999996
A199: 0.95 | B199: 0.72 | C199: =ABS(RC[-2]-RC[-1]) -> 0.22999999999999998
A200: 0.95 | B200: 0.7 | C200: =ABS(RC[-2]-RC[-1]) -> 0.25
A201: 0.92 | B201: 0.67 | C201: =ABS(RC[-2]-RC[-1]) -> 0.25
A202: 0.98 | B202: 0.61 | C202: =ABS(RC[-2]-RC[-1]) -> 0.37
A203: 0.95 | B203: 0.51 | C203: =ABS(RC[-2]-RC[-1]) -> 0.43999999999999995
A204: 0.99 | B204: 0.42 | C204: =ABS(RC[-2]-RC[-1]) -> 0.57000000000000006
A205: 0.94 | B205: 0.33 | C205: =ABS(RC[-2]-RC[-1]) -> 0.60999999999999988
A206: 0.98 | B206: 0.35 | C206: =ABS(RC[-2]-RC[-1]) -> 0.63
A207: 0.98 | B207: 0.34 | C207: =ABS(RC[-2]-RC[-1]) -> 0.6399999999999999